[
  {
    "branchNumber": 1,
    "customerNumber": 1008793,
    "currencyNumber": "EUR",
    "receiptNumber": 7,
    "receiptPosition": 301,
    "date": "2004-04-07T00:00:00",
    "paymentDueDate": null,
    "id": "a4b7a594-5f25-4af4-82b5-bf6362fb64d3",
    "staffNumber": 0,
    "cashRegisterNumber": 0,
    "number": 1,
    "status": 100,
    "amount": -49.95,
    "amountCleared": 3.0,
    "paymentConditionNumber": 0,
    "lastChange": "2019-10-22T20:11:44.567369",
    "isDeleted": false
  },
  {
    "branchNumber": 1,
    "customerNumber": 13063801,
    "currencyNumber": "EUR",
    "receiptNumber": 85,
    "receiptPosition": 301,
    "date": "2004-05-31T00:00:00",
    "paymentDueDate": null,
    "id": "a52a0a73-88f5-45d3-95f5-c1870c4a4756",
    "staffNumber": 0,
    "cashRegisterNumber": 0,
    "number": 3,
    "status": 1,
    "amount": -47.0,
    "amountCleared": 139.3,
    "paymentConditionNumber": 0,
    "lastChange": "2019-10-22T20:11:44.567369",
    "isDeleted": false
  },
  {
    "branchNumber": 1,
    "customerNumber": 1090,
    "currencyNumber": "EUR",
    "receiptNumber": 87,
    "receiptPosition": 301,
    "date": "2004-05-31T00:00:00",
    "paymentDueDate": null,
    "id": "01050760-f1c2-41b0-b623-3f493ba04c74",
    "staffNumber": 0,
    "cashRegisterNumber": 0,
    "number": 4,
    "status": 1,
    "amount": -29.92,
    "amountCleared": 0.0,
    "paymentConditionNumber": 0,
    "lastChange": "2019-10-22T20:11:44.567369",
    "isDeleted": false
  },
  {
    "branchNumber": 1,
    "customerNumber": 0,
    "currencyNumber": "EUR",
    "receiptNumber": 770,
    "receiptPosition": 301,
    "date": "2007-01-03T00:00:00",
    "paymentDueDate": null,
    "id": "74dcdd77-3928-47cc-96d6-90b42c164b42",
    "staffNumber": 0,
    "cashRegisterNumber": 0,
    "number": 143,
    "status": 1,
    "amount": -23.96,
    "amountCleared": 0.0,
    "paymentConditionNumber": 0,
    "lastChange": "2019-10-22T20:11:44.567369",
    "isDeleted": false
  },
  {
    "branchNumber": 1,
    "customerNumber": 0,
    "currencyNumber": "EUR",
    "receiptNumber": 772,
    "receiptPosition": 301,
    "date": "2006-12-29T00:00:00",
    "paymentDueDate": null,
    "id": "baf6cb9c-9554-48b1-869f-38893034a15b",
    "staffNumber": 0,
    "cashRegisterNumber": 0,
    "number": 145,
    "status": 1,
    "amount": -23.96,
    "amountCleared": 0.0,
    "paymentConditionNumber": 0,
    "lastChange": "2019-10-22T20:11:44.567369",
    "isDeleted": false
  },
  {
    "branchNumber": 1,
    "customerNumber": 1009763,
    "currencyNumber": "EUR",
    "receiptNumber": 1190,
    "receiptPosition": 301,
    "date": "2008-03-31T00:00:00",
    "paymentDueDate": null,
    "id": "268dc0a3-adde-48bc-9405-6e4ef8195c10",
    "staffNumber": 0,
    "cashRegisterNumber": 0,
    "number": 147,
    "status": 100,
    "amount": -64.9,
    "amountCleared": 0.0,
    "paymentConditionNumber": 0,
    "lastChange": "2019-10-22T20:11:44.567369",
    "isDeleted": false
  },
  {
    "branchNumber": 2,
    "customerNumber": 1012671,
    "currencyNumber": "EUR",
    "receiptNumber": 1626,
    "receiptPosition": 301,
    "date": "2009-04-02T00:00:00",
    "paymentDueDate": null,
    "id": "feed7b70-5b71-4cb5-b124-5f553bab5ef4",
    "staffNumber": 0,
    "cashRegisterNumber": 0,
    "number": 148,
    "status": 100,
    "amount": -39.95,
    "amountCleared": 0.0,
    "paymentConditionNumber": 0,
    "lastChange": "2019-10-22T20:11:44.567369",
    "isDeleted": false
  },
  {
    "branchNumber": 1,
    "customerNumber": 12153000,
    "currencyNumber": "EUR",
    "receiptNumber": 2342,
    "receiptPosition": 301,
    "date": "2010-09-29T00:00:00",
    "paymentDueDate": null,
    "id": "a6f1bbb9-ce99-4731-9b34-7d88458e1bdd",
    "staffNumber": 0,
    "cashRegisterNumber": 0,
    "number": 149,
    "status": 100,
    "amount": -29.9,
    "amountCleared": 0.0,
    "paymentConditionNumber": 0,
    "lastChange": "2019-10-22T20:11:44.567369",
    "isDeleted": false
  },
  {
    "branchNumber": 2,
    "customerNumber": 7057300,
    "currencyNumber": "EUR",
    "receiptNumber": 2351,
    "receiptPosition": 301,
    "date": "2010-10-04T00:00:00",
    "paymentDueDate": null,
    "id": "4d365728-9226-4b5a-8e3f-ea3611ef22ce",
    "staffNumber": 0,
    "cashRegisterNumber": 0,
    "number": 150,
    "status": 1,
    "amount": -47.8,
    "amountCleared": 0.0,
    "paymentConditionNumber": 0,
    "lastChange": "2019-10-22T20:11:44.567369",
    "isDeleted": false
  },
  {
    "branchNumber": 1,
    "customerNumber": 1014107,
    "currencyNumber": "EUR",
    "receiptNumber": 2925,
    "receiptPosition": 301,
    "date": "2011-11-18T00:00:00",
    "paymentDueDate": null,
    "id": "27e58424-21b6-44c9-9839-a44303c85747",
    "staffNumber": 0,
    "cashRegisterNumber": 0,
    "number": 151,
    "status": 101,
    "amount": 0.0,
    "amountCleared": 0.0,
    "paymentConditionNumber": 0,
    "lastChange": "2019-10-22T20:11:44.567369",
    "isDeleted": false
  },
  {
    "branchNumber": 1,
    "customerNumber": 1014174,
    "currencyNumber": "EUR",
    "receiptNumber": 2971,
    "receiptPosition": 301,
    "date": "2011-12-29T00:00:00",
    "paymentDueDate": null,
    "id": "ff3579d1-c2c2-4ef1-9ee6-1f6069a174e7",
    "staffNumber": 0,
    "cashRegisterNumber": 0,
    "number": 152,
    "status": 100,
    "amount": -54.95,
    "amountCleared": 0.0,
    "paymentConditionNumber": 0,
    "lastChange": "2019-10-22T20:11:44.567369",
    "isDeleted": false
  },
  {
    "branchNumber": 1,
    "customerNumber": 8038100,
    "currencyNumber": "EUR",
    "receiptNumber": 3169,
    "receiptPosition": 301,
    "date": "2012-05-15T00:00:00",
    "paymentDueDate": null,
    "id": "4a3932cf-c224-43bd-aa5a-c3abbc645593",
    "staffNumber": 0,
    "cashRegisterNumber": 0,
    "number": 153,
    "status": 100,
    "amount": 0.0,
    "amountCleared": 0.0,
    "paymentConditionNumber": 0,
    "lastChange": "2019-10-22T20:11:44.567369",
    "isDeleted": false
  },
  {
    "branchNumber": 1,
    "customerNumber": 8038100,
    "currencyNumber": "EUR",
    "receiptNumber": 3171,
    "receiptPosition": 301,
    "date": "2012-05-24T00:00:00",
    "paymentDueDate": null,
    "id": "4cc5c9d7-db16-4c89-bb47-429f76922d65",
    "staffNumber": 0,
    "cashRegisterNumber": 0,
    "number": 154,
    "status": 100,
    "amount": 0.0,
    "amountCleared": 0.0,
    "paymentConditionNumber": 0,
    "lastChange": "2019-10-22T20:11:44.567369",
    "isDeleted": false
  },
  {
    "branchNumber": 1,
    "customerNumber": 13063851,
    "currencyNumber": "EUR",
    "receiptNumber": 3439,
    "receiptPosition": 301,
    "date": "2012-12-27T00:00:00",
    "paymentDueDate": null,
    "id": "f9059613-2918-42cb-8c20-d4a4ea5468f2",
    "staffNumber": 0,
    "cashRegisterNumber": 0,
    "number": 155,
    "status": 100,
    "amount": 0.0,
    "amountCleared": 0.0,
    "paymentConditionNumber": 0,
    "lastChange": "2019-10-22T20:11:44.567369",
    "isDeleted": false
  },
  {
    "branchNumber": 1,
    "customerNumber": 23129500,
    "currencyNumber": "EUR",
    "receiptNumber": 4101,
    "receiptPosition": 301,
    "date": "2014-05-05T00:00:00",
    "paymentDueDate": null,
    "id": "ad1e013a-fc58-4165-a923-e40f29161b13",
    "staffNumber": 0,
    "cashRegisterNumber": 0,
    "number": 156,
    "status": 100,
    "amount": -159.0,
    "amountCleared": 0.0,
    "paymentConditionNumber": 0,
    "lastChange": "2019-10-22T20:11:44.567369",
    "isDeleted": false
  },
  {
    "branchNumber": 1,
    "customerNumber": 5110500,
    "currencyNumber": "EUR",
    "receiptNumber": 4124,
    "receiptPosition": 301,
    "date": "2013-12-18T00:00:00",
    "paymentDueDate": null,
    "id": "0691b70e-a85a-43df-b804-e4013ca18041",
    "staffNumber": 0,
    "cashRegisterNumber": 0,
    "number": 157,
    "status": 100,
    "amount": 0.0,
    "amountCleared": 0.0,
    "paymentConditionNumber": 0,
    "lastChange": "2019-10-22T20:11:44.567369",
    "isDeleted": false
  },
  {
    "branchNumber": 1,
    "customerNumber": 0,
    "currencyNumber": "EUR",
    "receiptNumber": 4326,
    "receiptPosition": 301,
    "date": "2014-11-14T00:00:00",
    "paymentDueDate": null,
    "id": "178b2752-2e08-4efa-bb5c-3902bbd41292",
    "staffNumber": 0,
    "cashRegisterNumber": 0,
    "number": 158,
    "status": 100,
    "amount": 122.2,
    "amountCleared": 0.0,
    "paymentConditionNumber": 0,
    "lastChange": "2019-10-22T20:11:44.567369",
    "isDeleted": false
  },
  {
    "branchNumber": 1,
    "customerNumber": 0,
    "currencyNumber": "EUR",
    "receiptNumber": 6075,
    "receiptPosition": 301,
    "date": "2018-07-02T00:00:00",
    "paymentDueDate": null,
    "id": "6eecc7c2-8216-496c-a092-ee74f8abf725",
    "staffNumber": 0,
    "cashRegisterNumber": 0,
    "number": 159,
    "status": 100,
    "amount": 48.9,
    "amountCleared": 0.0,
    "paymentConditionNumber": 0,
    "lastChange": "2024-04-02T10:33:05.6398121",
    "isDeleted": false
  },
  {
    "branchNumber": 1,
    "customerNumber": 16151000,
    "currencyNumber": "EUR",
    "receiptNumber": 6076,
    "receiptPosition": 301,
    "date": "2018-07-02T00:00:00",
    "paymentDueDate": null,
    "id": "4644a660-25c4-40fa-ab19-841ab122d3cd",
    "staffNumber": 0,
    "cashRegisterNumber": 0,
    "number": 160,
    "status": 100,
    "amount": 19.95,
    "amountCleared": 0.0,
    "paymentConditionNumber": 0,
    "lastChange": "2024-04-02T10:33:05.6398121",
    "isDeleted": false
  },
  {
    "branchNumber": 1,
    "customerNumber": 1202,
    "currencyNumber": "EUR",
    "receiptNumber": 6615,
    "receiptPosition": 301,
    "date": "2019-12-04T00:00:00",
    "paymentDueDate": null,
    "id": "81071c8b-551e-13a1-5f14-edad64adc1a0",
    "staffNumber": 0,
    "cashRegisterNumber": 0,
    "number": 161,
    "status": 1,
    "amount": 36.0,
    "amountCleared": 0.0,
    "paymentConditionNumber": 0,
    "lastChange": "2019-12-13T11:43:39.4233477",
    "isDeleted": false
  },
  {
    "branchNumber": 1,